{
  "version": 1,
  "runId": "gpt-5-6-luna-high",
  "stage": 2,
  "verifiedAt": "2026-06-29T04:14:38.860Z",
  "passed": true,
  "phaseContract": {
    "manifest": "specs/benchmark-phases.json",
    "specs": [
      "specs/nord-stage-4.visual.json",
      "specs/nord-stage-4.piano.json"
    ],
    "hardGates": 4,
    "acknowledgedHardGates": 4,
    "plan": "IMPLEMENTATION_PLAN.md"
  },
  "featureMatrix": {
    "path": "tests/feature-matrix.json",
    "coveredFeatures": 18,
    "requiredFeatures": 17
  },
  "implementationDetails": {
    "path": "IMPLEMENTATION_DETAILS.json",
    "audioStrategy": "Redistributable deterministic modal/physical piano model in Web Audio with the same in-memory renderer as an honest fallback.",
    "generatedSources": 1,
    "sampleSources": 0
  },
  "checks": [
    {
      "id": "test",
      "command": "pnpm run test",
      "passed": true,
      "durationMs": 5777,
      "detail": "Passed"
    },
    {
      "id": "typecheck",
      "command": "pnpm run typecheck",
      "passed": true,
      "durationMs": 1738,
      "detail": "Passed"
    },
    {
      "id": "lint",
      "command": "pnpm run lint",
      "passed": true,
      "durationMs": 778,
      "detail": "Passed"
    },
    {
      "id": "build",
      "command": "pnpm run build",
      "passed": true,
      "durationMs": 1110,
      "detail": "Passed"
    }
  ],
  "evidence": [
    {
      "id": "evidence/stage2-desktop.png",
      "passed": true,
      "detail": "evidence/stage2-desktop.png"
    },
    {
      "id": "evidence/stage2-narrow.png",
      "passed": true,
      "detail": "evidence/stage2-narrow.png"
    },
    {
      "id": "evidence/stage2-visual-audit.md",
      "passed": true,
      "detail": "evidence/stage2-visual-audit.md"
    }
  ]
}
