{
  "version": 1,
  "runId": "gpt-5-6-luna",
  "stage": 1,
  "verifiedAt": "2026-06-29T09:50:17.275Z",
  "passed": true,
  "phaseContract": {
    "manifest": "specs/benchmark-phases.json",
    "specs": [
      "specs/nord-stage-4.visual.json"
    ],
    "hardGates": 4,
    "acknowledgedHardGates": 4,
    "plan": "IMPLEMENTATION_PLAN.md"
  },
  "featureMatrix": {
    "path": "tests/feature-matrix.json",
    "coveredFeatures": 8,
    "requiredFeatures": 8
  },
  "implementationDetails": {
    "path": "IMPLEMENTATION_DETAILS.json",
    "audioStrategy": "None (visual-only phase)",
    "generatedSources": 0,
    "sampleSources": 0
  },
  "checks": [
    {
      "id": "test",
      "command": "pnpm run test",
      "passed": true,
      "durationMs": 2202,
      "detail": "Passed"
    },
    {
      "id": "typecheck",
      "command": "pnpm run typecheck",
      "passed": true,
      "durationMs": 947,
      "detail": "Passed"
    },
    {
      "id": "lint",
      "command": "pnpm run lint",
      "passed": true,
      "durationMs": 912,
      "detail": "Passed"
    },
    {
      "id": "build",
      "command": "pnpm run build",
      "passed": true,
      "durationMs": 504,
      "detail": "Passed"
    }
  ],
  "evidence": [
    {
      "id": "evidence/stage1-desktop.png",
      "passed": true,
      "detail": "evidence/stage1-desktop.png"
    },
    {
      "id": "evidence/stage1-narrow.png",
      "passed": true,
      "detail": "evidence/stage1-narrow.png"
    },
    {
      "id": "evidence/stage1-visual-audit.md",
      "passed": true,
      "detail": "evidence/stage1-visual-audit.md"
    }
  ]
}
